{
  "artifacts": [
    {
      "path": "cargo-version.txt",
      "sha256": "fcfafeedf9e1047337cbc09d4b2279bbf73c68b0230dadfa2551a3122a92fe7c",
      "size": 336
    },
    {
      "path": "clippy.status.txt",
      "sha256": "9a271f2a916b0b6ee6cecb2426f0b3206ef074578be55d9bc94f6f3fe3ab86aa",
      "size": 2
    },
    {
      "path": "clippy.stderr",
      "sha256": "736e2582f563605dd272e5fb977840b0c0767377d27b6940c440caf75eec7157",
      "size": 72
    },
    {
      "path": "clippy.stdout",
      "sha256": "e3b0c44298fc1c149afbf4c8996fb92427ae41e4649b934ca495991b7852b855",
      "size": 0
    },
    {
      "path": "deny.status.txt",
      "sha256": "9a271f2a916b0b6ee6cecb2426f0b3206ef074578be55d9bc94f6f3fe3ab86aa",
      "size": 2
    },
    {
      "path": "deny.stderr",
      "sha256": "a9633919034425d54c7f51b7cd0b66482e06765a814aa0bb863422e6120c64eb",
      "size": 1364
    },
    {
      "path": "deny.stdout",
      "sha256": "71dadc8c8978da797b94dc581b666330c737551839c8fc820d7647130930c4b7",
      "size": 12
    },
    {
      "path": "fmt.status.txt",
      "sha256": "9a271f2a916b0b6ee6cecb2426f0b3206ef074578be55d9bc94f6f3fe3ab86aa",
      "size": 2
    },
    {
      "path": "fmt.stderr",
      "sha256": "e3b0c44298fc1c149afbf4c8996fb92427ae41e4649b934ca495991b7852b855",
      "size": 0
    },
    {
      "path": "fmt.stdout",
      "sha256": "e3b0c44298fc1c149afbf4c8996fb92427ae41e4649b934ca495991b7852b855",
      "size": 0
    },
    {
      "path": "jsonschema-version.txt",
      "sha256": "33bdaf9e2d6bcbde2e4e613e865e403f8fe21fc621078d34c30b0bdc7f68d903",
      "size": 6
    },
    {
      "path": "metadata.status.txt",
      "sha256": "9a271f2a916b0b6ee6cecb2426f0b3206ef074578be55d9bc94f6f3fe3ab86aa",
      "size": 2
    },
    {
      "path": "metadata.stderr",
      "sha256": "e3b0c44298fc1c149afbf4c8996fb92427ae41e4649b934ca495991b7852b855",
      "size": 0
    },
    {
      "path": "metadata.stdout",
      "sha256": "6f7801aa162fb8e89ff4790d97dded1ce6ab705b51de7ab1c3e6649872e96314",
      "size": 1657
    },
    {
      "path": "msrv-rustc-version.txt",
      "sha256": "7eab200f5307bd6b0fd9d257e06480351b842c8cbddf2e597103021073b4e6ee",
      "size": 196
    },
    {
      "path": "msrv.status.txt",
      "sha256": "9a271f2a916b0b6ee6cecb2426f0b3206ef074578be55d9bc94f6f3fe3ab86aa",
      "size": 2
    },
    {
      "path": "msrv.stderr",
      "sha256": "09a053a15526bf7167c5aa9861af62a3344d79b10e706c7a5fe95ecef7ee8574",
      "size": 62
    },
    {
      "path": "msrv.stdout",
      "sha256": "e3b0c44298fc1c149afbf4c8996fb92427ae41e4649b934ca495991b7852b855",
      "size": 0
    },
    {
      "path": "python-version.txt",
      "sha256": "f6b75e07f1488db28a89724a522725e3e01af3dc78f6fd365f17eb4059e41056",
      "size": 15
    },
    {
      "path": "quire-provenance.json",
      "sha256": "6df2f8c787012733dbcaab24f8810dd127a508513ba521a852592539c938ec91",
      "size": 664
    },
    {
      "path": "quire-validate.status.txt",
      "sha256": "9a271f2a916b0b6ee6cecb2426f0b3206ef074578be55d9bc94f6f3fe3ab86aa",
      "size": 2
    },
    {
      "path": "quire-validate.stderr",
      "sha256": "b490d70ffe44774238fa50820f6579c975ca17aecd4f1b03f8b24ad119f724eb",
      "size": 689
    },
    {
      "path": "quire-validate.stdout",
      "sha256": "e3b0c44298fc1c149afbf4c8996fb92427ae41e4649b934ca495991b7852b855",
      "size": 0
    },
    {
      "path": "recorded-at.txt",
      "sha256": "d72c677233478040fa0f988974672cda9b4c9f98c6cc8c751535d32f58dd7129",
      "size": 21
    },
    {
      "path": "rustc-version.txt",
      "sha256": "a834181975ab3494d51a1a01e4a9d4321fecd674a52e3db3cf93b3b84b6fc2c1",
      "size": 196
    },
    {
      "path": "rustdoc.status.txt",
      "sha256": "9a271f2a916b0b6ee6cecb2426f0b3206ef074578be55d9bc94f6f3fe3ab86aa",
      "size": 2
    },
    {
      "path": "rustdoc.stderr",
      "sha256": "ed0b1badb2f3daabdc18d52bf8a8026220ad5a91bb55a5b715d9356235476207",
      "size": 241
    },
    {
      "path": "rustdoc.stdout",
      "sha256": "e3b0c44298fc1c149afbf4c8996fb92427ae41e4649b934ca495991b7852b855",
      "size": 0
    },
    {
      "path": "source-revision.txt",
      "sha256": "199d85e6dca0dd3d928bfef888fc8fd1393364aad1e9a1d123a1b04fbec12f6b",
      "size": 41
    },
    {
      "path": "source-state.txt",
      "sha256": "2e22da2ab13713309ac75219e525b8e06ed02f3f1963b8feef203fa25827f93d",
      "size": 6
    },
    {
      "path": "test.status.txt",
      "sha256": "9a271f2a916b0b6ee6cecb2426f0b3206ef074578be55d9bc94f6f3fe3ab86aa",
      "size": 2
    },
    {
      "path": "test.stderr",
      "sha256": "0718c57c32e15f1ad5e14b8a7175b5d611f6d78fdb828e3437f56f8e899f3a46",
      "size": 340
    },
    {
      "path": "test.stdout",
      "sha256": "f2537aa76480bd33c22043e06e27d1c1aeae40633ed51ac8bf6a7724680a9d4f",
      "size": 410
    },
    {
      "path": "unsafe-audit.status.txt",
      "sha256": "9a271f2a916b0b6ee6cecb2426f0b3206ef074578be55d9bc94f6f3fe3ab86aa",
      "size": 2
    },
    {
      "path": "unsafe-audit.stderr",
      "sha256": "e3b0c44298fc1c149afbf4c8996fb92427ae41e4649b934ca495991b7852b855",
      "size": 0
    },
    {
      "path": "unsafe-audit.stdout",
      "sha256": "e3b0c44298fc1c149afbf4c8996fb92427ae41e4649b934ca495991b7852b855",
      "size": 0
    }
  ],
  "collectedAt": "2026-08-31T15:42:49Z",
  "limitations": [
    "foundation evidence does not establish semantic code-generation conformance",
    "authoritative IR schema and corpus have no candidate revision",
    "runtime candidate is draft and requires final reconciliation",
    "remote CI, CODEOWNER approval, and the human source-release decision are pending"
  ],
  "outcomes": [
    {
      "name": "quire-validate",
      "status": "passed"
    },
    {
      "name": "fmt",
      "status": "passed"
    },
    {
      "name": "clippy",
      "status": "passed"
    },
    {
      "name": "test",
      "status": "passed"
    },
    {
      "name": "msrv",
      "status": "passed"
    },
    {
      "name": "deny",
      "status": "passed"
    },
    {
      "name": "unsafe-audit",
      "status": "passed"
    },
    {
      "name": "metadata",
      "status": "passed"
    },
    {
      "name": "rustdoc",
      "status": "passed"
    },
    {
      "name": "pgm01-pinned-schema",
      "status": "passed"
    },
    {
      "name": "input-schema",
      "status": "passed"
    },
    {
      "name": "manifest-schema",
      "status": "passed"
    },
    {
      "name": "pgm01-schema",
      "status": "passed"
    },
    {
      "name": "pgm01-envelope",
      "status": "failed"
    }
  ],
  "schemaVersion": "quire.codegen-foundation-evidence-manifest/v1",
  "sourceRevision": "a7790d22574666ce092ad2e4cc6f7959121f9849"
}
