{
  "artifacts": [
    {
      "path": "cargo-version.txt",
      "sha256": "fcfafeedf9e1047337cbc09d4b2279bbf73c68b0230dadfa2551a3122a92fe7c",
      "size": 336
    },
    {
      "path": "clippy.status.txt",
      "sha256": "9a271f2a916b0b6ee6cecb2426f0b3206ef074578be55d9bc94f6f3fe3ab86aa",
      "size": 2
    },
    {
      "path": "clippy.stderr",
      "sha256": "8c233a54790c4800d3dd585436af679aa838da259bfdb129412e2d51cdb75cdc",
      "size": 72
    },
    {
      "path": "clippy.stdout",
      "sha256": "e3b0c44298fc1c149afbf4c8996fb92427ae41e4649b934ca495991b7852b855",
      "size": 0
    },
    {
      "path": "coverage.status.txt",
      "sha256": "9a271f2a916b0b6ee6cecb2426f0b3206ef074578be55d9bc94f6f3fe3ab86aa",
      "size": 2
    },
    {
      "path": "coverage.stderr",
      "sha256": "7a5f6f18334467056e679c2890762774b336b04a722cc3b517081b9e78d2a25f",
      "size": 797
    },
    {
      "path": "coverage.stdout",
      "sha256": "2c3d98d98712b2fd1408d0efae3e0043996af1464fb96ee8b2f8bd9ff6185877",
      "size": 116
    },
    {
      "path": "deny.status.txt",
      "sha256": "9a271f2a916b0b6ee6cecb2426f0b3206ef074578be55d9bc94f6f3fe3ab86aa",
      "size": 2
    },
    {
      "path": "deny.stderr",
      "sha256": "457a30eb6d9193607cc69d1a247131aaa8b3c4e24b2a7d48224eddd9adfbf132",
      "size": 691
    },
    {
      "path": "deny.stdout",
      "sha256": "f1a0fca39d4280363937aabd77783990ea6480bd9ca257816de3b68fc8efa845",
      "size": 48
    },
    {
      "path": "evidence-tool.status.txt",
      "sha256": "9a271f2a916b0b6ee6cecb2426f0b3206ef074578be55d9bc94f6f3fe3ab86aa",
      "size": 2
    },
    {
      "path": "evidence-tool.stderr",
      "sha256": "6e37fcf3f639ca12591cdcb1436372e773681032cc8c1b284ec42aeb2a32c66f",
      "size": 171
    },
    {
      "path": "evidence-tool.stdout",
      "sha256": "59fcbc8aa55f4c5a1e945c2e78f7211fd91807d47c507871b835c684f8eb82d2",
      "size": 381
    },
    {
      "path": "fmt.status.txt",
      "sha256": "9a271f2a916b0b6ee6cecb2426f0b3206ef074578be55d9bc94f6f3fe3ab86aa",
      "size": 2
    },
    {
      "path": "fmt.stderr",
      "sha256": "e3b0c44298fc1c149afbf4c8996fb92427ae41e4649b934ca495991b7852b855",
      "size": 0
    },
    {
      "path": "fmt.stdout",
      "sha256": "e61ce2b087b3ebcb7bb4920885a5498d64a1fb16352a02a9fe0decd7341b67ad",
      "size": 17
    },
    {
      "path": "ir-validator-revision.txt",
      "sha256": "b0f0f437550657320a1a2db7c4aed31954e8b74f1a3b504fd07ef0a99de896dd",
      "size": 41
    },
    {
      "path": "jsonschema-version.txt",
      "sha256": "33bdaf9e2d6bcbde2e4e613e865e403f8fe21fc621078d34c30b0bdc7f68d903",
      "size": 6
    },
    {
      "path": "metadata.status.txt",
      "sha256": "9a271f2a916b0b6ee6cecb2426f0b3206ef074578be55d9bc94f6f3fe3ab86aa",
      "size": 2
    },
    {
      "path": "metadata.stderr",
      "sha256": "e3b0c44298fc1c149afbf4c8996fb92427ae41e4649b934ca495991b7852b855",
      "size": 0
    },
    {
      "path": "metadata.stdout",
      "sha256": "afc8cf8c4ecb0a6b5f6e44e3cb74b94ea20cbfcc26864cda253559aa6b735ef9",
      "size": 412897
    },
    {
      "path": "msrv-rustc-version.txt",
      "sha256": "7eab200f5307bd6b0fd9d257e06480351b842c8cbddf2e597103021073b4e6ee",
      "size": 196
    },
    {
      "path": "msrv.status.txt",
      "sha256": "9a271f2a916b0b6ee6cecb2426f0b3206ef074578be55d9bc94f6f3fe3ab86aa",
      "size": 2
    },
    {
      "path": "msrv.stderr",
      "sha256": "5edc42f7b921fcfcd5fc6e11d575f176024dad6b0fa15972d3c26885cfd9e643",
      "size": 605
    },
    {
      "path": "msrv.stdout",
      "sha256": "2540323fcaba29d18872babe77d68eb9ebfd03211a9d69ce15578bc4b2f8ff4c",
      "size": 1223
    },
    {
      "path": "pgm01-schema-path.txt",
      "sha256": "5681518fbd8edcfb943965a763b0f4424a5393d618814b5b684c672b801dd9c5",
      "size": 85
    },
    {
      "path": "pgm01-schema-sha256.txt",
      "sha256": "33d1c337ae9a612a2f724e7ec9b9688934f620c423402671ba5a50bde3004a68",
      "size": 65
    },
    {
      "path": "pgm01-validator-path.txt",
      "sha256": "a206ee91dabdcd9c01137eac346887e4577eee0f731b4e1d3bb51f47a7c145d7",
      "size": 64
    },
    {
      "path": "pgm01-validator-sha256.txt",
      "sha256": "9c0815b277093a5de065756331da2194f598de92d50760b17e8dbacdef3fed3e",
      "size": 65
    },
    {
      "path": "python-packages.txt",
      "sha256": "1324898e3beb06dc36ab35551f51edc415185329c798899c45476be04d532ad7",
      "size": 3955
    },
    {
      "path": "python-version.txt",
      "sha256": "f6b75e07f1488db28a89724a522725e3e01af3dc78f6fd365f17eb4059e41056",
      "size": 15
    },
    {
      "path": "quire-provenance.json",
      "sha256": "6df2f8c787012733dbcaab24f8810dd127a508513ba521a852592539c938ec91",
      "size": 664
    },
    {
      "path": "quire-validate.status.txt",
      "sha256": "9a271f2a916b0b6ee6cecb2426f0b3206ef074578be55d9bc94f6f3fe3ab86aa",
      "size": 2
    },
    {
      "path": "quire-validate.stderr",
      "sha256": "b490d70ffe44774238fa50820f6579c975ca17aecd4f1b03f8b24ad119f724eb",
      "size": 689
    },
    {
      "path": "quire-validate.stdout",
      "sha256": "0156d76c89e8d40eba6c6dccaed165b0397fabb2370b5832728e9d04fab1e8d2",
      "size": 24
    },
    {
      "path": "recorded-at.txt",
      "sha256": "29a63829c7748ea2d3e4911cac3c231493921bf8269f83da129380030b4f2a24",
      "size": 21
    },
    {
      "path": "reviewer-of-record.txt",
      "sha256": "af9b9e769ad6180a7643f81427d79eb22ea40871d459e230616038adc6d34059",
      "size": 11
    },
    {
      "path": "rustc-version.txt",
      "sha256": "a834181975ab3494d51a1a01e4a9d4321fecd674a52e3db3cf93b3b84b6fc2c1",
      "size": 196
    },
    {
      "path": "rustdoc.status.txt",
      "sha256": "9a271f2a916b0b6ee6cecb2426f0b3206ef074578be55d9bc94f6f3fe3ab86aa",
      "size": 2
    },
    {
      "path": "rustdoc.stderr",
      "sha256": "85e14b069df29b208ae1112483d09a3531355bb733720439a94c599c257890bd",
      "size": 169
    },
    {
      "path": "rustdoc.stdout",
      "sha256": "e3b0c44298fc1c149afbf4c8996fb92427ae41e4649b934ca495991b7852b855",
      "size": 0
    },
    {
      "path": "source-revision.txt",
      "sha256": "c7f673af4c6f483394cfee3aadac31a63f4b81d7ae3de4376bd83b2681dd1e99",
      "size": 41
    },
    {
      "path": "source-state.txt",
      "sha256": "2e22da2ab13713309ac75219e525b8e06ed02f3f1963b8feef203fa25827f93d",
      "size": 6
    },
    {
      "path": "test.status.txt",
      "sha256": "9a271f2a916b0b6ee6cecb2426f0b3206ef074578be55d9bc94f6f3fe3ab86aa",
      "size": 2
    },
    {
      "path": "test.stderr",
      "sha256": "e90ecb30fea6a46e58d9455fa7d6feeae0ad8b396076e783924acfe5d113c4e0",
      "size": 381
    },
    {
      "path": "test.stdout",
      "sha256": "be8657fd71005ea79a187c6cd35439f08a5bbdf2894c6a63d1e98d4a6691c246",
      "size": 1222
    },
    {
      "path": "unsafe-audit.status.txt",
      "sha256": "9a271f2a916b0b6ee6cecb2426f0b3206ef074578be55d9bc94f6f3fe3ab86aa",
      "size": 2
    },
    {
      "path": "unsafe-audit.stderr",
      "sha256": "e3b0c44298fc1c149afbf4c8996fb92427ae41e4649b934ca495991b7852b855",
      "size": 0
    },
    {
      "path": "unsafe-audit.stdout",
      "sha256": "277d297847387ef1234a06b27853fd0fb1388cf7bb8a5b5c0a508f0e03783bfd",
      "size": 20
    }
  ],
  "collectedAt": "2026-09-01T00:53:15Z",
  "limitations": [
    "foundation evidence does not establish semantic code-generation conformance",
    "runtime source is merged; its human source-release decision remains pending",
    "hosted CI is intentionally deferred by operator direction",
    "inconclusive foundation outcome: coverage"
  ],
  "outcomes": [
    {
      "name": "clippy",
      "status": "passed"
    },
    {
      "name": "coverage",
      "status": "inconclusive"
    },
    {
      "name": "deny",
      "status": "passed"
    },
    {
      "name": "evidence-tool",
      "status": "passed"
    },
    {
      "name": "fmt",
      "status": "passed"
    },
    {
      "name": "input-schema",
      "status": "passed"
    },
    {
      "name": "manifest-schema",
      "status": "passed"
    },
    {
      "name": "metadata",
      "status": "passed"
    },
    {
      "name": "msrv",
      "status": "passed"
    },
    {
      "name": "pgm01-envelope",
      "status": "passed"
    },
    {
      "name": "pgm01-pinned-schema",
      "status": "passed"
    },
    {
      "name": "pgm01-schema",
      "status": "passed"
    },
    {
      "name": "quire-validate",
      "status": "passed"
    },
    {
      "name": "rustdoc",
      "status": "passed"
    },
    {
      "name": "test",
      "status": "passed"
    },
    {
      "name": "unsafe-audit",
      "status": "passed"
    }
  ],
  "schemaVersion": "quire.codegen-foundation-evidence-manifest/v1",
  "sourceRevision": "ad384644f07f8ec7ea9afae9c97529589f0c57b1"
}
