{
  "artifacts": [
    {
      "path": "cargo-version.txt",
      "sha256": "fcfafeedf9e1047337cbc09d4b2279bbf73c68b0230dadfa2551a3122a92fe7c",
      "size": 336
    },
    {
      "path": "clippy.stderr",
      "sha256": "65fd2159c3fca55fc51a639e5334b82321d401dbe7bac385cc630b70db0e483d",
      "size": 156
    },
    {
      "path": "clippy.stdout",
      "sha256": "e3b0c44298fc1c149afbf4c8996fb92427ae41e4649b934ca495991b7852b855",
      "size": 0
    },
    {
      "path": "deny.stderr",
      "sha256": "a9633919034425d54c7f51b7cd0b66482e06765a814aa0bb863422e6120c64eb",
      "size": 1364
    },
    {
      "path": "deny.stdout",
      "sha256": "71dadc8c8978da797b94dc581b666330c737551839c8fc820d7647130930c4b7",
      "size": 12
    },
    {
      "path": "fmt.stderr",
      "sha256": "e3b0c44298fc1c149afbf4c8996fb92427ae41e4649b934ca495991b7852b855",
      "size": 0
    },
    {
      "path": "fmt.stdout",
      "sha256": "e3b0c44298fc1c149afbf4c8996fb92427ae41e4649b934ca495991b7852b855",
      "size": 0
    },
    {
      "path": "jsonschema-version.txt",
      "sha256": "33bdaf9e2d6bcbde2e4e613e865e403f8fe21fc621078d34c30b0bdc7f68d903",
      "size": 6
    },
    {
      "path": "metadata.stderr",
      "sha256": "e3b0c44298fc1c149afbf4c8996fb92427ae41e4649b934ca495991b7852b855",
      "size": 0
    },
    {
      "path": "metadata.stdout",
      "sha256": "9aa519c582d6b1fb18370981f5f2e5eb759e0009a0561ff9ad582cc7fe32853d",
      "size": 1747
    },
    {
      "path": "msrv-rustc-version.txt",
      "sha256": "7eab200f5307bd6b0fd9d257e06480351b842c8cbddf2e597103021073b4e6ee",
      "size": 196
    },
    {
      "path": "msrv.stderr",
      "sha256": "a8042e6c116af755b5e59d7bb361332d456c86ae721c2d3af1626a411a61d1ec",
      "size": 146
    },
    {
      "path": "msrv.stdout",
      "sha256": "e3b0c44298fc1c149afbf4c8996fb92427ae41e4649b934ca495991b7852b855",
      "size": 0
    },
    {
      "path": "python-version.txt",
      "sha256": "f6b75e07f1488db28a89724a522725e3e01af3dc78f6fd365f17eb4059e41056",
      "size": 15
    },
    {
      "path": "quire-provenance.json",
      "sha256": "6df2f8c787012733dbcaab24f8810dd127a508513ba521a852592539c938ec91",
      "size": 664
    },
    {
      "path": "quire-validate.stderr",
      "sha256": "b490d70ffe44774238fa50820f6579c975ca17aecd4f1b03f8b24ad119f724eb",
      "size": 689
    },
    {
      "path": "quire-validate.stdout",
      "sha256": "e3b0c44298fc1c149afbf4c8996fb92427ae41e4649b934ca495991b7852b855",
      "size": 0
    },
    {
      "path": "rustc-version.txt",
      "sha256": "a834181975ab3494d51a1a01e4a9d4321fecd674a52e3db3cf93b3b84b6fc2c1",
      "size": 196
    },
    {
      "path": "rustdoc.stderr",
      "sha256": "a57e23b51a30e4d00d72ba38a991879b9850c2a76af5c8a5ca15d85240e2690b",
      "size": 286
    },
    {
      "path": "rustdoc.stdout",
      "sha256": "e3b0c44298fc1c149afbf4c8996fb92427ae41e4649b934ca495991b7852b855",
      "size": 0
    },
    {
      "path": "source-revision.txt",
      "sha256": "7fd0f419b9f9ffbd766ad1726d50d438b8883371d7fd737d4f0d046a290d8a30",
      "size": 41
    },
    {
      "path": "source-state.txt",
      "sha256": "2e22da2ab13713309ac75219e525b8e06ed02f3f1963b8feef203fa25827f93d",
      "size": 6
    },
    {
      "path": "test.stderr",
      "sha256": "1f76f1ce22b1bf0d28805352aff74ae36f53be575993acd4a5bfe29f3488ae37",
      "size": 436
    },
    {
      "path": "test.stdout",
      "sha256": "f2537aa76480bd33c22043e06e27d1c1aeae40633ed51ac8bf6a7724680a9d4f",
      "size": 410
    },
    {
      "path": "unsafe-audit.stderr",
      "sha256": "e3b0c44298fc1c149afbf4c8996fb92427ae41e4649b934ca495991b7852b855",
      "size": 0
    },
    {
      "path": "unsafe-audit.stdout",
      "sha256": "e3b0c44298fc1c149afbf4c8996fb92427ae41e4649b934ca495991b7852b855",
      "size": 0
    }
  ],
  "collectedAt": "2026-08-31T00:56:03Z",
  "limitations": [
    "foundation evidence does not establish semantic code-generation conformance",
    "authoritative IR schema and corpus have no candidate revision",
    "runtime candidate is draft and requires final reconciliation",
    "remote CI, CODEOWNER approval, and the human source-release decision are pending"
  ],
  "outcomes": [
    {
      "name": "quire-validate",
      "status": "passed"
    },
    {
      "name": "fmt",
      "status": "passed"
    },
    {
      "name": "clippy",
      "status": "passed"
    },
    {
      "name": "test",
      "status": "passed"
    },
    {
      "name": "msrv",
      "status": "passed"
    },
    {
      "name": "deny",
      "status": "passed"
    },
    {
      "name": "unsafe-audit",
      "status": "passed"
    },
    {
      "name": "metadata",
      "status": "passed"
    },
    {
      "name": "rustdoc",
      "status": "passed"
    },
    {
      "name": "pgm01-pinned-schema",
      "status": "passed"
    }
  ],
  "schemaVersion": "quire.codegen-foundation-evidence-manifest/v1",
  "sourceRevision": "1ed7e8e0d7c05323217e632f8734ef73a19c1195"
}
