{
  "artifacts": [
    {
      "path": "cargo-version.txt",
      "sha256": "fcfafeedf9e1047337cbc09d4b2279bbf73c68b0230dadfa2551a3122a92fe7c",
      "size": 336
    },
    {
      "path": "clippy.status.txt",
      "sha256": "9a271f2a916b0b6ee6cecb2426f0b3206ef074578be55d9bc94f6f3fe3ab86aa",
      "size": 2
    },
    {
      "path": "clippy.stderr",
      "sha256": "65fd2159c3fca55fc51a639e5334b82321d401dbe7bac385cc630b70db0e483d",
      "size": 156
    },
    {
      "path": "clippy.stdout",
      "sha256": "e3b0c44298fc1c149afbf4c8996fb92427ae41e4649b934ca495991b7852b855",
      "size": 0
    },
    {
      "path": "coverage.status.txt",
      "sha256": "9a271f2a916b0b6ee6cecb2426f0b3206ef074578be55d9bc94f6f3fe3ab86aa",
      "size": 2
    },
    {
      "path": "coverage.stderr",
      "sha256": "fc59ec0e025cc41205e80c03479686bf60d7c16a4d29f071e8364d8969e07c7e",
      "size": 769
    },
    {
      "path": "coverage.stdout",
      "sha256": "a77796359902538902bcb4cf6642d1ad2e631c5f04bbc8c1fcb7ecba8209c52c",
      "size": 116
    },
    {
      "path": "deny.status.txt",
      "sha256": "9a271f2a916b0b6ee6cecb2426f0b3206ef074578be55d9bc94f6f3fe3ab86aa",
      "size": 2
    },
    {
      "path": "deny.stderr",
      "sha256": "a9633919034425d54c7f51b7cd0b66482e06765a814aa0bb863422e6120c64eb",
      "size": 1364
    },
    {
      "path": "deny.stdout",
      "sha256": "71dadc8c8978da797b94dc581b666330c737551839c8fc820d7647130930c4b7",
      "size": 12
    },
    {
      "path": "evidence-tool.status.txt",
      "sha256": "9a271f2a916b0b6ee6cecb2426f0b3206ef074578be55d9bc94f6f3fe3ab86aa",
      "size": 2
    },
    {
      "path": "evidence-tool.stderr",
      "sha256": "119cca5ff181140be7785637e846d1da6530fc9319f3532b800002050e5301f9",
      "size": 116
    },
    {
      "path": "evidence-tool.stdout",
      "sha256": "e9c3c30c7455826cf14f484080f5ab31018543d91195e2a6da7529ce09c81297",
      "size": 210
    },
    {
      "path": "fmt.status.txt",
      "sha256": "9a271f2a916b0b6ee6cecb2426f0b3206ef074578be55d9bc94f6f3fe3ab86aa",
      "size": 2
    },
    {
      "path": "fmt.stderr",
      "sha256": "e3b0c44298fc1c149afbf4c8996fb92427ae41e4649b934ca495991b7852b855",
      "size": 0
    },
    {
      "path": "fmt.stdout",
      "sha256": "e3b0c44298fc1c149afbf4c8996fb92427ae41e4649b934ca495991b7852b855",
      "size": 0
    },
    {
      "path": "jsonschema-version.txt",
      "sha256": "33bdaf9e2d6bcbde2e4e613e865e403f8fe21fc621078d34c30b0bdc7f68d903",
      "size": 6
    },
    {
      "path": "metadata.status.txt",
      "sha256": "9a271f2a916b0b6ee6cecb2426f0b3206ef074578be55d9bc94f6f3fe3ab86aa",
      "size": 2
    },
    {
      "path": "metadata.stderr",
      "sha256": "e3b0c44298fc1c149afbf4c8996fb92427ae41e4649b934ca495991b7852b855",
      "size": 0
    },
    {
      "path": "metadata.stdout",
      "sha256": "f2d2c2a08c21de87d3d99fb0e6722c3b47f5459189912cc8be7e85bb8242fc36",
      "size": 1667
    },
    {
      "path": "msrv-rustc-version.txt",
      "sha256": "7eab200f5307bd6b0fd9d257e06480351b842c8cbddf2e597103021073b4e6ee",
      "size": 196
    },
    {
      "path": "msrv.status.txt",
      "sha256": "9a271f2a916b0b6ee6cecb2426f0b3206ef074578be55d9bc94f6f3fe3ab86aa",
      "size": 2
    },
    {
      "path": "msrv.stderr",
      "sha256": "a8042e6c116af755b5e59d7bb361332d456c86ae721c2d3af1626a411a61d1ec",
      "size": 146
    },
    {
      "path": "msrv.stdout",
      "sha256": "e3b0c44298fc1c149afbf4c8996fb92427ae41e4649b934ca495991b7852b855",
      "size": 0
    },
    {
      "path": "pgm01-revision.txt",
      "sha256": "908a712c849e4cc8de2675f0cd76c4ae5745d74a20689c1f40081cf1e88f914b",
      "size": 41
    },
    {
      "path": "pgm01-schema-path.txt",
      "sha256": "cc489c9c948cd22cc67f144ec21e1f502fa12f8ba96f4e7e20c99af2688ca793",
      "size": 82
    },
    {
      "path": "pgm01-schema-sha256.txt",
      "sha256": "33d1c337ae9a612a2f724e7ec9b9688934f620c423402671ba5a50bde3004a68",
      "size": 65
    },
    {
      "path": "pgm01-validator-path.txt",
      "sha256": "c5d5fc78b72dbb1849ad88e233c7b6b5a503f693f1e84a6743830747f2015da4",
      "size": 61
    },
    {
      "path": "pgm01-validator-sha256.txt",
      "sha256": "9c0815b277093a5de065756331da2194f598de92d50760b17e8dbacdef3fed3e",
      "size": 65
    },
    {
      "path": "python-packages.txt",
      "sha256": "8ff2061d88dd67ca798893a2d5516757018226e3e4ab695c87d2b9053171d4c4",
      "size": 144
    },
    {
      "path": "python-version.txt",
      "sha256": "f6b75e07f1488db28a89724a522725e3e01af3dc78f6fd365f17eb4059e41056",
      "size": 15
    },
    {
      "path": "quire-provenance.json",
      "sha256": "6df2f8c787012733dbcaab24f8810dd127a508513ba521a852592539c938ec91",
      "size": 664
    },
    {
      "path": "quire-validate.status.txt",
      "sha256": "9a271f2a916b0b6ee6cecb2426f0b3206ef074578be55d9bc94f6f3fe3ab86aa",
      "size": 2
    },
    {
      "path": "quire-validate.stderr",
      "sha256": "b490d70ffe44774238fa50820f6579c975ca17aecd4f1b03f8b24ad119f724eb",
      "size": 689
    },
    {
      "path": "quire-validate.stdout",
      "sha256": "e3b0c44298fc1c149afbf4c8996fb92427ae41e4649b934ca495991b7852b855",
      "size": 0
    },
    {
      "path": "recorded-at.txt",
      "sha256": "02dde4815a4d46cecb98d65d3fd53cd864a81894ab4bc97ce92c798289ee3cbe",
      "size": 21
    },
    {
      "path": "reviewer-of-record.txt",
      "sha256": "af9b9e769ad6180a7643f81427d79eb22ea40871d459e230616038adc6d34059",
      "size": 11
    },
    {
      "path": "rustc-version.txt",
      "sha256": "a834181975ab3494d51a1a01e4a9d4321fecd674a52e3db3cf93b3b84b6fc2c1",
      "size": 196
    },
    {
      "path": "rustdoc.status.txt",
      "sha256": "9a271f2a916b0b6ee6cecb2426f0b3206ef074578be55d9bc94f6f3fe3ab86aa",
      "size": 2
    },
    {
      "path": "rustdoc.stderr",
      "sha256": "669bc0f1e27c3852cf338ad603b38b3d0617076dbd564572dfe4ab28705ba0bb",
      "size": 246
    },
    {
      "path": "rustdoc.stdout",
      "sha256": "e3b0c44298fc1c149afbf4c8996fb92427ae41e4649b934ca495991b7852b855",
      "size": 0
    },
    {
      "path": "source-revision.txt",
      "sha256": "2486d72b09550585a9cf8706172d79446993377030924224496b0d6aed6212f6",
      "size": 41
    },
    {
      "path": "source-state.txt",
      "sha256": "2e22da2ab13713309ac75219e525b8e06ed02f3f1963b8feef203fa25827f93d",
      "size": 6
    },
    {
      "path": "test.status.txt",
      "sha256": "9a271f2a916b0b6ee6cecb2426f0b3206ef074578be55d9bc94f6f3fe3ab86aa",
      "size": 2
    },
    {
      "path": "test.stderr",
      "sha256": "f3b0e307aef6112c3cfd3b104818a485bcc73ff55902558594a8ba686bcf2f44",
      "size": 434
    },
    {
      "path": "test.stdout",
      "sha256": "f2537aa76480bd33c22043e06e27d1c1aeae40633ed51ac8bf6a7724680a9d4f",
      "size": 410
    },
    {
      "path": "unsafe-audit.status.txt",
      "sha256": "9a271f2a916b0b6ee6cecb2426f0b3206ef074578be55d9bc94f6f3fe3ab86aa",
      "size": 2
    },
    {
      "path": "unsafe-audit.stderr",
      "sha256": "e3b0c44298fc1c149afbf4c8996fb92427ae41e4649b934ca495991b7852b855",
      "size": 0
    },
    {
      "path": "unsafe-audit.stdout",
      "sha256": "e3b0c44298fc1c149afbf4c8996fb92427ae41e4649b934ca495991b7852b855",
      "size": 0
    }
  ],
  "collectedAt": "2026-08-31T17:20:40Z",
  "limitations": [
    "foundation evidence does not establish semantic code-generation conformance",
    "authoritative IR schema and corpus candidate remains under review",
    "runtime source is merged; its human source-release decision remains pending",
    "hosted CI is intentionally deferred by operator direction",
    "inconclusive foundation outcome: coverage"
  ],
  "outcomes": [
    {
      "name": "clippy",
      "status": "passed"
    },
    {
      "name": "coverage",
      "status": "inconclusive"
    },
    {
      "name": "deny",
      "status": "passed"
    },
    {
      "name": "evidence-tool",
      "status": "passed"
    },
    {
      "name": "fmt",
      "status": "passed"
    },
    {
      "name": "input-schema",
      "status": "passed"
    },
    {
      "name": "manifest-schema",
      "status": "passed"
    },
    {
      "name": "metadata",
      "status": "passed"
    },
    {
      "name": "msrv",
      "status": "passed"
    },
    {
      "name": "pgm01-envelope",
      "status": "passed"
    },
    {
      "name": "pgm01-pinned-schema",
      "status": "passed"
    },
    {
      "name": "pgm01-schema",
      "status": "passed"
    },
    {
      "name": "quire-validate",
      "status": "passed"
    },
    {
      "name": "rustdoc",
      "status": "passed"
    },
    {
      "name": "test",
      "status": "passed"
    },
    {
      "name": "unsafe-audit",
      "status": "passed"
    }
  ],
  "schemaVersion": "quire.codegen-foundation-evidence-manifest/v1",
  "sourceRevision": "984594e48a0cab68c5852de7ff211a345d96bf17"
}
