{
  "artifacts": [
    {
      "path": "cargo-version.txt",
      "sha256": "fcfafeedf9e1047337cbc09d4b2279bbf73c68b0230dadfa2551a3122a92fe7c",
      "size": 336
    },
    {
      "path": "clippy.status.txt",
      "sha256": "9a271f2a916b0b6ee6cecb2426f0b3206ef074578be55d9bc94f6f3fe3ab86aa",
      "size": 2
    },
    {
      "path": "clippy.stderr",
      "sha256": "b9fc8769290ad9c344f4abc8495eb9621f709f48ad101ee6b9a1ffb25b21d38b",
      "size": 2863
    },
    {
      "path": "clippy.stdout",
      "sha256": "e3b0c44298fc1c149afbf4c8996fb92427ae41e4649b934ca495991b7852b855",
      "size": 0
    },
    {
      "path": "coverage.status.txt",
      "sha256": "9a271f2a916b0b6ee6cecb2426f0b3206ef074578be55d9bc94f6f3fe3ab86aa",
      "size": 2
    },
    {
      "path": "coverage.stderr",
      "sha256": "7a5f6f18334467056e679c2890762774b336b04a722cc3b517081b9e78d2a25f",
      "size": 797
    },
    {
      "path": "coverage.stdout",
      "sha256": "2c3d98d98712b2fd1408d0efae3e0043996af1464fb96ee8b2f8bd9ff6185877",
      "size": 116
    },
    {
      "path": "deny.status.txt",
      "sha256": "4355a46b19d348dc2f57c046f8ef63d4538ebb936000f3c9ee954a27460dd865",
      "size": 2
    },
    {
      "path": "deny.stderr",
      "sha256": "c10ad866e5aa12c4312af150fcc532e7d9ace8e286e4e8812e015f03d5d9a66f",
      "size": 196
    },
    {
      "path": "deny.stdout",
      "sha256": "e3b0c44298fc1c149afbf4c8996fb92427ae41e4649b934ca495991b7852b855",
      "size": 0
    },
    {
      "path": "evidence-tool.status.txt",
      "sha256": "9a271f2a916b0b6ee6cecb2426f0b3206ef074578be55d9bc94f6f3fe3ab86aa",
      "size": 2
    },
    {
      "path": "evidence-tool.stderr",
      "sha256": "ec0fbadc0fd0e9904ba3f798b6e6a8503765f9881517e9b8f563953fbb9a1322",
      "size": 141
    },
    {
      "path": "evidence-tool.stdout",
      "sha256": "dff535b93479609289576201eeb9c7f4b8f2b5032b6ac2fc05cce6f236821e49",
      "size": 299
    },
    {
      "path": "fmt.status.txt",
      "sha256": "9a271f2a916b0b6ee6cecb2426f0b3206ef074578be55d9bc94f6f3fe3ab86aa",
      "size": 2
    },
    {
      "path": "fmt.stderr",
      "sha256": "e3b0c44298fc1c149afbf4c8996fb92427ae41e4649b934ca495991b7852b855",
      "size": 0
    },
    {
      "path": "fmt.stdout",
      "sha256": "e3b0c44298fc1c149afbf4c8996fb92427ae41e4649b934ca495991b7852b855",
      "size": 0
    },
    {
      "path": "jsonschema-version.txt",
      "sha256": "33bdaf9e2d6bcbde2e4e613e865e403f8fe21fc621078d34c30b0bdc7f68d903",
      "size": 6
    },
    {
      "path": "metadata.status.txt",
      "sha256": "9a271f2a916b0b6ee6cecb2426f0b3206ef074578be55d9bc94f6f3fe3ab86aa",
      "size": 2
    },
    {
      "path": "metadata.stderr",
      "sha256": "e3b0c44298fc1c149afbf4c8996fb92427ae41e4649b934ca495991b7852b855",
      "size": 0
    },
    {
      "path": "metadata.stdout",
      "sha256": "6f954af9c6288d65ec9a7acece316ad1691c7dd36327d34913b120cac49281b8",
      "size": 412871
    },
    {
      "path": "msrv-rustc-version.txt",
      "sha256": "7eab200f5307bd6b0fd9d257e06480351b842c8cbddf2e597103021073b4e6ee",
      "size": 196
    },
    {
      "path": "msrv.status.txt",
      "sha256": "39b8dc3fc8b44765c8e6f1adee04c5b465e555ab791cc42d0d9e810d5b64297c",
      "size": 4
    },
    {
      "path": "msrv.stderr",
      "sha256": "ca129b81c01456c8c003e00efb1b60c4338ad08f98530618aa6d3c64a152fd9b",
      "size": 3266
    },
    {
      "path": "msrv.stdout",
      "sha256": "fac361bfe5e4b595c529d362361ae262d55a47e1589da6ba98b531fc4294fb3a",
      "size": 1567
    },
    {
      "path": "pgm01-revision.txt",
      "sha256": "b0f0f437550657320a1a2db7c4aed31954e8b74f1a3b504fd07ef0a99de896dd",
      "size": 41
    },
    {
      "path": "pgm01-schema-path.txt",
      "sha256": "5681518fbd8edcfb943965a763b0f4424a5393d618814b5b684c672b801dd9c5",
      "size": 85
    },
    {
      "path": "pgm01-schema-sha256.txt",
      "sha256": "33d1c337ae9a612a2f724e7ec9b9688934f620c423402671ba5a50bde3004a68",
      "size": 65
    },
    {
      "path": "pgm01-validator-path.txt",
      "sha256": "a206ee91dabdcd9c01137eac346887e4577eee0f731b4e1d3bb51f47a7c145d7",
      "size": 64
    },
    {
      "path": "pgm01-validator-sha256.txt",
      "sha256": "9c0815b277093a5de065756331da2194f598de92d50760b17e8dbacdef3fed3e",
      "size": 65
    },
    {
      "path": "python-packages.txt",
      "sha256": "8ff2061d88dd67ca798893a2d5516757018226e3e4ab695c87d2b9053171d4c4",
      "size": 144
    },
    {
      "path": "python-version.txt",
      "sha256": "f6b75e07f1488db28a89724a522725e3e01af3dc78f6fd365f17eb4059e41056",
      "size": 15
    },
    {
      "path": "quire-provenance.json",
      "sha256": "6df2f8c787012733dbcaab24f8810dd127a508513ba521a852592539c938ec91",
      "size": 664
    },
    {
      "path": "quire-validate.status.txt",
      "sha256": "9a271f2a916b0b6ee6cecb2426f0b3206ef074578be55d9bc94f6f3fe3ab86aa",
      "size": 2
    },
    {
      "path": "quire-validate.stderr",
      "sha256": "b490d70ffe44774238fa50820f6579c975ca17aecd4f1b03f8b24ad119f724eb",
      "size": 689
    },
    {
      "path": "quire-validate.stdout",
      "sha256": "e3b0c44298fc1c149afbf4c8996fb92427ae41e4649b934ca495991b7852b855",
      "size": 0
    },
    {
      "path": "recorded-at.txt",
      "sha256": "a90ffea3161297477fc63aae948d78455fb96a8ecb06839f10b0cf60947fbe86",
      "size": 21
    },
    {
      "path": "reviewer-of-record.txt",
      "sha256": "af9b9e769ad6180a7643f81427d79eb22ea40871d459e230616038adc6d34059",
      "size": 11
    },
    {
      "path": "rustc-version.txt",
      "sha256": "a834181975ab3494d51a1a01e4a9d4321fecd674a52e3db3cf93b3b84b6fc2c1",
      "size": 196
    },
    {
      "path": "rustdoc.status.txt",
      "sha256": "9a271f2a916b0b6ee6cecb2426f0b3206ef074578be55d9bc94f6f3fe3ab86aa",
      "size": 2
    },
    {
      "path": "rustdoc.stderr",
      "sha256": "cac8f413832fa0a87cb1c1b8a99ca019b0b2d5758f962eece7ab942353fdd9ac",
      "size": 240
    },
    {
      "path": "rustdoc.stdout",
      "sha256": "e3b0c44298fc1c149afbf4c8996fb92427ae41e4649b934ca495991b7852b855",
      "size": 0
    },
    {
      "path": "source-revision.txt",
      "sha256": "86d75be0a9e06c9d21b2cba7850b4267b9f11e06503783a4f1497a4e85c21401",
      "size": 41
    },
    {
      "path": "source-state.txt",
      "sha256": "2e22da2ab13713309ac75219e525b8e06ed02f3f1963b8feef203fa25827f93d",
      "size": 6
    },
    {
      "path": "test.status.txt",
      "sha256": "39b8dc3fc8b44765c8e6f1adee04c5b465e555ab791cc42d0d9e810d5b64297c",
      "size": 4
    },
    {
      "path": "test.stderr",
      "sha256": "5039e1965e6890755f293a21434581164756c69b10d36ced40265ec98a952c25",
      "size": 3128
    },
    {
      "path": "test.stdout",
      "sha256": "ed0dc1b37b091ef94e5923618265d16da52f8d9147e9886201bba25cdfbb87e8",
      "size": 1574
    },
    {
      "path": "unsafe-audit.status.txt",
      "sha256": "9a271f2a916b0b6ee6cecb2426f0b3206ef074578be55d9bc94f6f3fe3ab86aa",
      "size": 2
    },
    {
      "path": "unsafe-audit.stderr",
      "sha256": "e3b0c44298fc1c149afbf4c8996fb92427ae41e4649b934ca495991b7852b855",
      "size": 0
    },
    {
      "path": "unsafe-audit.stdout",
      "sha256": "e3b0c44298fc1c149afbf4c8996fb92427ae41e4649b934ca495991b7852b855",
      "size": 0
    }
  ],
  "collectedAt": "2026-08-31T20:44:48Z",
  "limitations": [
    "foundation evidence does not establish semantic code-generation conformance",
    "runtime source is merged; its human source-release decision remains pending",
    "hosted CI is intentionally deferred by operator direction",
    "failed foundation outcome: deny",
    "failed foundation outcome: metadata",
    "failed foundation outcome: msrv",
    "failed foundation outcome: test",
    "inconclusive foundation outcome: coverage"
  ],
  "outcomes": [
    {
      "name": "clippy",
      "status": "passed"
    },
    {
      "name": "coverage",
      "status": "inconclusive"
    },
    {
      "name": "deny",
      "status": "failed"
    },
    {
      "name": "evidence-tool",
      "status": "passed"
    },
    {
      "name": "fmt",
      "status": "passed"
    },
    {
      "name": "input-schema",
      "status": "passed"
    },
    {
      "name": "manifest-schema",
      "status": "passed"
    },
    {
      "name": "metadata",
      "status": "failed"
    },
    {
      "name": "msrv",
      "status": "failed"
    },
    {
      "name": "pgm01-envelope",
      "status": "passed"
    },
    {
      "name": "pgm01-pinned-schema",
      "status": "passed"
    },
    {
      "name": "pgm01-schema",
      "status": "passed"
    },
    {
      "name": "quire-validate",
      "status": "passed"
    },
    {
      "name": "rustdoc",
      "status": "passed"
    },
    {
      "name": "test",
      "status": "failed"
    },
    {
      "name": "unsafe-audit",
      "status": "passed"
    }
  ],
  "schemaVersion": "quire.codegen-foundation-evidence-manifest/v1",
  "sourceRevision": "ea7ec33c48e1e22ce3f06066075d86d7c4ec411a"
}
