{
  "artifacts": [
    {
      "path": "cargo-version.txt",
      "sha256": "fcfafeedf9e1047337cbc09d4b2279bbf73c68b0230dadfa2551a3122a92fe7c",
      "size": 336
    },
    {
      "path": "clippy.status.txt",
      "sha256": "9a271f2a916b0b6ee6cecb2426f0b3206ef074578be55d9bc94f6f3fe3ab86aa",
      "size": 2
    },
    {
      "path": "clippy.stderr",
      "sha256": "8c233a54790c4800d3dd585436af679aa838da259bfdb129412e2d51cdb75cdc",
      "size": 72
    },
    {
      "path": "clippy.stdout",
      "sha256": "e3b0c44298fc1c149afbf4c8996fb92427ae41e4649b934ca495991b7852b855",
      "size": 0
    },
    {
      "path": "coverage.status.txt",
      "sha256": "9a271f2a916b0b6ee6cecb2426f0b3206ef074578be55d9bc94f6f3fe3ab86aa",
      "size": 2
    },
    {
      "path": "coverage.stderr",
      "sha256": "7a5f6f18334467056e679c2890762774b336b04a722cc3b517081b9e78d2a25f",
      "size": 797
    },
    {
      "path": "coverage.stdout",
      "sha256": "2c3d98d98712b2fd1408d0efae3e0043996af1464fb96ee8b2f8bd9ff6185877",
      "size": 116
    },
    {
      "path": "deny.status.txt",
      "sha256": "9a271f2a916b0b6ee6cecb2426f0b3206ef074578be55d9bc94f6f3fe3ab86aa",
      "size": 2
    },
    {
      "path": "deny.stderr",
      "sha256": "457a30eb6d9193607cc69d1a247131aaa8b3c4e24b2a7d48224eddd9adfbf132",
      "size": 691
    },
    {
      "path": "deny.stdout",
      "sha256": "f1a0fca39d4280363937aabd77783990ea6480bd9ca257816de3b68fc8efa845",
      "size": 48
    },
    {
      "path": "evidence-tool.status.txt",
      "sha256": "9a271f2a916b0b6ee6cecb2426f0b3206ef074578be55d9bc94f6f3fe3ab86aa",
      "size": 2
    },
    {
      "path": "evidence-tool.stderr",
      "sha256": "a585909a233f741219edaa5afb9ddc5196d05436f225dd37e83f9d8253aa9595",
      "size": 141
    },
    {
      "path": "evidence-tool.stdout",
      "sha256": "dff535b93479609289576201eeb9c7f4b8f2b5032b6ac2fc05cce6f236821e49",
      "size": 299
    },
    {
      "path": "fmt.status.txt",
      "sha256": "9a271f2a916b0b6ee6cecb2426f0b3206ef074578be55d9bc94f6f3fe3ab86aa",
      "size": 2
    },
    {
      "path": "fmt.stderr",
      "sha256": "e3b0c44298fc1c149afbf4c8996fb92427ae41e4649b934ca495991b7852b855",
      "size": 0
    },
    {
      "path": "fmt.stdout",
      "sha256": "e3b0c44298fc1c149afbf4c8996fb92427ae41e4649b934ca495991b7852b855",
      "size": 0
    },
    {
      "path": "jsonschema-version.txt",
      "sha256": "33bdaf9e2d6bcbde2e4e613e865e403f8fe21fc621078d34c30b0bdc7f68d903",
      "size": 6
    },
    {
      "path": "metadata.status.txt",
      "sha256": "9a271f2a916b0b6ee6cecb2426f0b3206ef074578be55d9bc94f6f3fe3ab86aa",
      "size": 2
    },
    {
      "path": "metadata.stderr",
      "sha256": "e3b0c44298fc1c149afbf4c8996fb92427ae41e4649b934ca495991b7852b855",
      "size": 0
    },
    {
      "path": "metadata.stdout",
      "sha256": "6f954af9c6288d65ec9a7acece316ad1691c7dd36327d34913b120cac49281b8",
      "size": 412871
    },
    {
      "path": "msrv-rustc-version.txt",
      "sha256": "7eab200f5307bd6b0fd9d257e06480351b842c8cbddf2e597103021073b4e6ee",
      "size": 196
    },
    {
      "path": "msrv.status.txt",
      "sha256": "9a271f2a916b0b6ee6cecb2426f0b3206ef074578be55d9bc94f6f3fe3ab86aa",
      "size": 2
    },
    {
      "path": "msrv.stderr",
      "sha256": "eb3d73f556056cf9796cdfd326218a901503d546f710c743e59197f604db440e",
      "size": 683
    },
    {
      "path": "msrv.stdout",
      "sha256": "458b88379cc7ed3cd58f47792624a5477ad767b1d88fb99fdb3f3ecde1b862e8",
      "size": 1223
    },
    {
      "path": "pgm01-revision.txt",
      "sha256": "b0f0f437550657320a1a2db7c4aed31954e8b74f1a3b504fd07ef0a99de896dd",
      "size": 41
    },
    {
      "path": "pgm01-schema-path.txt",
      "sha256": "5681518fbd8edcfb943965a763b0f4424a5393d618814b5b684c672b801dd9c5",
      "size": 85
    },
    {
      "path": "pgm01-schema-sha256.txt",
      "sha256": "33d1c337ae9a612a2f724e7ec9b9688934f620c423402671ba5a50bde3004a68",
      "size": 65
    },
    {
      "path": "pgm01-validator-path.txt",
      "sha256": "a206ee91dabdcd9c01137eac346887e4577eee0f731b4e1d3bb51f47a7c145d7",
      "size": 64
    },
    {
      "path": "pgm01-validator-sha256.txt",
      "sha256": "9c0815b277093a5de065756331da2194f598de92d50760b17e8dbacdef3fed3e",
      "size": 65
    },
    {
      "path": "python-packages.txt",
      "sha256": "8ff2061d88dd67ca798893a2d5516757018226e3e4ab695c87d2b9053171d4c4",
      "size": 144
    },
    {
      "path": "python-version.txt",
      "sha256": "f6b75e07f1488db28a89724a522725e3e01af3dc78f6fd365f17eb4059e41056",
      "size": 15
    },
    {
      "path": "quire-provenance.json",
      "sha256": "6df2f8c787012733dbcaab24f8810dd127a508513ba521a852592539c938ec91",
      "size": 664
    },
    {
      "path": "quire-validate.status.txt",
      "sha256": "9a271f2a916b0b6ee6cecb2426f0b3206ef074578be55d9bc94f6f3fe3ab86aa",
      "size": 2
    },
    {
      "path": "quire-validate.stderr",
      "sha256": "b490d70ffe44774238fa50820f6579c975ca17aecd4f1b03f8b24ad119f724eb",
      "size": 689
    },
    {
      "path": "quire-validate.stdout",
      "sha256": "e3b0c44298fc1c149afbf4c8996fb92427ae41e4649b934ca495991b7852b855",
      "size": 0
    },
    {
      "path": "recorded-at.txt",
      "sha256": "9ae1160e5e2bb5a1b09e101ec4fe7e903f356ad23c5217d752c2a65ee3922530",
      "size": 21
    },
    {
      "path": "reviewer-of-record.txt",
      "sha256": "af9b9e769ad6180a7643f81427d79eb22ea40871d459e230616038adc6d34059",
      "size": 11
    },
    {
      "path": "rustc-version.txt",
      "sha256": "a834181975ab3494d51a1a01e4a9d4321fecd674a52e3db3cf93b3b84b6fc2c1",
      "size": 196
    },
    {
      "path": "rustdoc.status.txt",
      "sha256": "9a271f2a916b0b6ee6cecb2426f0b3206ef074578be55d9bc94f6f3fe3ab86aa",
      "size": 2
    },
    {
      "path": "rustdoc.stderr",
      "sha256": "23be568630923a8baa48d593d8b64cd44d2257b7f8a07a061ae086cabb04c9d5",
      "size": 240
    },
    {
      "path": "rustdoc.stdout",
      "sha256": "e3b0c44298fc1c149afbf4c8996fb92427ae41e4649b934ca495991b7852b855",
      "size": 0
    },
    {
      "path": "source-revision.txt",
      "sha256": "5b1ecab32378e52d102744fe70b2a7c62f892695c129bdf72d7ac08c848fa7e5",
      "size": 41
    },
    {
      "path": "source-state.txt",
      "sha256": "2e22da2ab13713309ac75219e525b8e06ed02f3f1963b8feef203fa25827f93d",
      "size": 6
    },
    {
      "path": "test.status.txt",
      "sha256": "9a271f2a916b0b6ee6cecb2426f0b3206ef074578be55d9bc94f6f3fe3ab86aa",
      "size": 2
    },
    {
      "path": "test.stderr",
      "sha256": "9678a237807af1d173f64cceab3b0d15bbad1a419c322f90cc76798c3707c718",
      "size": 459
    },
    {
      "path": "test.stdout",
      "sha256": "b5c048bb2d7e35131cee399670c9b233a016176322ab5857aafb173372a7c129",
      "size": 1222
    },
    {
      "path": "unsafe-audit.status.txt",
      "sha256": "9a271f2a916b0b6ee6cecb2426f0b3206ef074578be55d9bc94f6f3fe3ab86aa",
      "size": 2
    },
    {
      "path": "unsafe-audit.stderr",
      "sha256": "e3b0c44298fc1c149afbf4c8996fb92427ae41e4649b934ca495991b7852b855",
      "size": 0
    },
    {
      "path": "unsafe-audit.stdout",
      "sha256": "e3b0c44298fc1c149afbf4c8996fb92427ae41e4649b934ca495991b7852b855",
      "size": 0
    }
  ],
  "collectedAt": "2026-08-31T20:55:01Z",
  "limitations": [
    "foundation evidence does not establish semantic code-generation conformance",
    "runtime source is merged; its human source-release decision remains pending",
    "hosted CI is intentionally deferred by operator direction",
    "failed foundation outcome: metadata",
    "inconclusive foundation outcome: coverage"
  ],
  "outcomes": [
    {
      "name": "clippy",
      "status": "passed"
    },
    {
      "name": "coverage",
      "status": "inconclusive"
    },
    {
      "name": "deny",
      "status": "passed"
    },
    {
      "name": "evidence-tool",
      "status": "passed"
    },
    {
      "name": "fmt",
      "status": "passed"
    },
    {
      "name": "input-schema",
      "status": "passed"
    },
    {
      "name": "manifest-schema",
      "status": "passed"
    },
    {
      "name": "metadata",
      "status": "failed"
    },
    {
      "name": "msrv",
      "status": "passed"
    },
    {
      "name": "pgm01-envelope",
      "status": "passed"
    },
    {
      "name": "pgm01-pinned-schema",
      "status": "passed"
    },
    {
      "name": "pgm01-schema",
      "status": "passed"
    },
    {
      "name": "quire-validate",
      "status": "passed"
    },
    {
      "name": "rustdoc",
      "status": "passed"
    },
    {
      "name": "test",
      "status": "passed"
    },
    {
      "name": "unsafe-audit",
      "status": "passed"
    }
  ],
  "schemaVersion": "quire.codegen-foundation-evidence-manifest/v1",
  "sourceRevision": "98a1fc3e6a94d01d4df03da09bd26ac409a68a57"
}
