{
  "artifacts": [
    {
      "path": "cargo-version.txt",
      "sha256": "fcfafeedf9e1047337cbc09d4b2279bbf73c68b0230dadfa2551a3122a92fe7c",
      "size": 336
    },
    {
      "path": "clippy.status.txt",
      "sha256": "9a271f2a916b0b6ee6cecb2426f0b3206ef074578be55d9bc94f6f3fe3ab86aa",
      "size": 2
    },
    {
      "path": "clippy.stderr",
      "sha256": "65fd2159c3fca55fc51a639e5334b82321d401dbe7bac385cc630b70db0e483d",
      "size": 156
    },
    {
      "path": "clippy.stdout",
      "sha256": "e3b0c44298fc1c149afbf4c8996fb92427ae41e4649b934ca495991b7852b855",
      "size": 0
    },
    {
      "path": "coverage.status.txt",
      "sha256": "9a271f2a916b0b6ee6cecb2426f0b3206ef074578be55d9bc94f6f3fe3ab86aa",
      "size": 2
    },
    {
      "path": "coverage.stderr",
      "sha256": "e958036e16e76332983b25090dbf43d805fcd8c4f2f7697c266ba808323b00a9",
      "size": 834
    },
    {
      "path": "coverage.stdout",
      "sha256": "a77796359902538902bcb4cf6642d1ad2e631c5f04bbc8c1fcb7ecba8209c52c",
      "size": 116
    },
    {
      "path": "deny.status.txt",
      "sha256": "9a271f2a916b0b6ee6cecb2426f0b3206ef074578be55d9bc94f6f3fe3ab86aa",
      "size": 2
    },
    {
      "path": "deny.stderr",
      "sha256": "a9633919034425d54c7f51b7cd0b66482e06765a814aa0bb863422e6120c64eb",
      "size": 1364
    },
    {
      "path": "deny.stdout",
      "sha256": "f1a0fca39d4280363937aabd77783990ea6480bd9ca257816de3b68fc8efa845",
      "size": 48
    },
    {
      "path": "evidence-tool.status.txt",
      "sha256": "9a271f2a916b0b6ee6cecb2426f0b3206ef074578be55d9bc94f6f3fe3ab86aa",
      "size": 2
    },
    {
      "path": "evidence-tool.stderr",
      "sha256": "c4f9fd9dd1f935555b2bcf1448ad1749a058af396c3c1db4c0d28b3b6c2d3a96",
      "size": 155
    },
    {
      "path": "evidence-tool.stdout",
      "sha256": "18320d6237e2152fb3e16670f3b036feb0e134c2395a841ba7f2ea6c9bd77101",
      "size": 354
    },
    {
      "path": "fmt.status.txt",
      "sha256": "9a271f2a916b0b6ee6cecb2426f0b3206ef074578be55d9bc94f6f3fe3ab86aa",
      "size": 2
    },
    {
      "path": "fmt.stderr",
      "sha256": "e3b0c44298fc1c149afbf4c8996fb92427ae41e4649b934ca495991b7852b855",
      "size": 0
    },
    {
      "path": "fmt.stdout",
      "sha256": "e3b0c44298fc1c149afbf4c8996fb92427ae41e4649b934ca495991b7852b855",
      "size": 0
    },
    {
      "path": "ir-validator-revision.txt",
      "sha256": "b0f0f437550657320a1a2db7c4aed31954e8b74f1a3b504fd07ef0a99de896dd",
      "size": 41
    },
    {
      "path": "jsonschema-version.txt",
      "sha256": "33bdaf9e2d6bcbde2e4e613e865e403f8fe21fc621078d34c30b0bdc7f68d903",
      "size": 6
    },
    {
      "path": "metadata.status.txt",
      "sha256": "9a271f2a916b0b6ee6cecb2426f0b3206ef074578be55d9bc94f6f3fe3ab86aa",
      "size": 2
    },
    {
      "path": "metadata.stderr",
      "sha256": "e3b0c44298fc1c149afbf4c8996fb92427ae41e4649b934ca495991b7852b855",
      "size": 0
    },
    {
      "path": "metadata.stdout",
      "sha256": "7588984e678f84c3e9342cc629a2add622d782c6eeb7e1072aef5e203fcf3dda",
      "size": 1639
    },
    {
      "path": "msrv-rustc-version.txt",
      "sha256": "7eab200f5307bd6b0fd9d257e06480351b842c8cbddf2e597103021073b4e6ee",
      "size": 196
    },
    {
      "path": "msrv.status.txt",
      "sha256": "9a271f2a916b0b6ee6cecb2426f0b3206ef074578be55d9bc94f6f3fe3ab86aa",
      "size": 2
    },
    {
      "path": "msrv.stderr",
      "sha256": "991ce4b1cfcbae0d29879a0e614deca05d1b38b1c1ae1fe7980391394a8dc554",
      "size": 396
    },
    {
      "path": "msrv.stdout",
      "sha256": "f2537aa76480bd33c22043e06e27d1c1aeae40633ed51ac8bf6a7724680a9d4f",
      "size": 410
    },
    {
      "path": "pgm01-schema-path.txt",
      "sha256": "5681518fbd8edcfb943965a763b0f4424a5393d618814b5b684c672b801dd9c5",
      "size": 85
    },
    {
      "path": "pgm01-schema-sha256.txt",
      "sha256": "33d1c337ae9a612a2f724e7ec9b9688934f620c423402671ba5a50bde3004a68",
      "size": 65
    },
    {
      "path": "pgm01-validator-path.txt",
      "sha256": "a206ee91dabdcd9c01137eac346887e4577eee0f731b4e1d3bb51f47a7c145d7",
      "size": 64
    },
    {
      "path": "pgm01-validator-sha256.txt",
      "sha256": "9c0815b277093a5de065756331da2194f598de92d50760b17e8dbacdef3fed3e",
      "size": 65
    },
    {
      "path": "python-packages.txt",
      "sha256": "1324898e3beb06dc36ab35551f51edc415185329c798899c45476be04d532ad7",
      "size": 3955
    },
    {
      "path": "python-version.txt",
      "sha256": "f6b75e07f1488db28a89724a522725e3e01af3dc78f6fd365f17eb4059e41056",
      "size": 15
    },
    {
      "path": "quire-provenance.json",
      "sha256": "6df2f8c787012733dbcaab24f8810dd127a508513ba521a852592539c938ec91",
      "size": 664
    },
    {
      "path": "quire-validate.status.txt",
      "sha256": "9a271f2a916b0b6ee6cecb2426f0b3206ef074578be55d9bc94f6f3fe3ab86aa",
      "size": 2
    },
    {
      "path": "quire-validate.stderr",
      "sha256": "b490d70ffe44774238fa50820f6579c975ca17aecd4f1b03f8b24ad119f724eb",
      "size": 689
    },
    {
      "path": "quire-validate.stdout",
      "sha256": "0156d76c89e8d40eba6c6dccaed165b0397fabb2370b5832728e9d04fab1e8d2",
      "size": 24
    },
    {
      "path": "recorded-at.txt",
      "sha256": "1dcdd8eafd1baa36e776ea9f0129518fcd27760fdcf8f1ccdb350e2d9da2b390",
      "size": 21
    },
    {
      "path": "reviewer-of-record.txt",
      "sha256": "af9b9e769ad6180a7643f81427d79eb22ea40871d459e230616038adc6d34059",
      "size": 11
    },
    {
      "path": "rustc-version.txt",
      "sha256": "a834181975ab3494d51a1a01e4a9d4321fecd674a52e3db3cf93b3b84b6fc2c1",
      "size": 196
    },
    {
      "path": "rustdoc.status.txt",
      "sha256": "9a271f2a916b0b6ee6cecb2426f0b3206ef074578be55d9bc94f6f3fe3ab86aa",
      "size": 2
    },
    {
      "path": "rustdoc.stderr",
      "sha256": "482d684b3d0986379e83674021276512f9d14141404876e8cd329b90805b27e2",
      "size": 232
    },
    {
      "path": "rustdoc.stdout",
      "sha256": "e3b0c44298fc1c149afbf4c8996fb92427ae41e4649b934ca495991b7852b855",
      "size": 0
    },
    {
      "path": "source-revision.txt",
      "sha256": "465a34427381a3c0b932afe88dbf0b7e6daecdc2485a2e62664567b89d9fc6c6",
      "size": 41
    },
    {
      "path": "source-state.txt",
      "sha256": "2e22da2ab13713309ac75219e525b8e06ed02f3f1963b8feef203fa25827f93d",
      "size": 6
    },
    {
      "path": "test.status.txt",
      "sha256": "9a271f2a916b0b6ee6cecb2426f0b3206ef074578be55d9bc94f6f3fe3ab86aa",
      "size": 2
    },
    {
      "path": "test.stderr",
      "sha256": "0c9666c49ddc34b73a859b6f94bd12c7a4f7b2107a11503dc6bdc7db2a6a31c3",
      "size": 322
    },
    {
      "path": "test.stdout",
      "sha256": "f2537aa76480bd33c22043e06e27d1c1aeae40633ed51ac8bf6a7724680a9d4f",
      "size": 410
    },
    {
      "path": "unsafe-audit.status.txt",
      "sha256": "4355a46b19d348dc2f57c046f8ef63d4538ebb936000f3c9ee954a27460dd865",
      "size": 2
    },
    {
      "path": "unsafe-audit.stderr",
      "sha256": "6f1e67b01acb8b9a6e80000f9ffd39c608dbc89cfb508621ea8f668cc026c28b",
      "size": 74
    },
    {
      "path": "unsafe-audit.stdout",
      "sha256": "e3b0c44298fc1c149afbf4c8996fb92427ae41e4649b934ca495991b7852b855",
      "size": 0
    }
  ],
  "collectedAt": "2026-08-31T22:41:47Z",
  "limitations": [
    "foundation evidence does not establish semantic code-generation conformance",
    "runtime source is merged; its human source-release decision remains pending",
    "hosted CI is intentionally deferred by operator direction",
    "failed foundation outcome: unsafe-audit",
    "inconclusive foundation outcome: coverage"
  ],
  "outcomes": [
    {
      "name": "clippy",
      "status": "passed"
    },
    {
      "name": "coverage",
      "status": "inconclusive"
    },
    {
      "name": "deny",
      "status": "passed"
    },
    {
      "name": "evidence-tool",
      "status": "passed"
    },
    {
      "name": "fmt",
      "status": "passed"
    },
    {
      "name": "input-schema",
      "status": "passed"
    },
    {
      "name": "manifest-schema",
      "status": "passed"
    },
    {
      "name": "metadata",
      "status": "passed"
    },
    {
      "name": "msrv",
      "status": "passed"
    },
    {
      "name": "pgm01-envelope",
      "status": "passed"
    },
    {
      "name": "pgm01-pinned-schema",
      "status": "passed"
    },
    {
      "name": "pgm01-schema",
      "status": "passed"
    },
    {
      "name": "quire-validate",
      "status": "passed"
    },
    {
      "name": "rustdoc",
      "status": "passed"
    },
    {
      "name": "test",
      "status": "passed"
    },
    {
      "name": "unsafe-audit",
      "status": "failed"
    }
  ],
  "schemaVersion": "quire.codegen-foundation-evidence-manifest/v1",
  "sourceRevision": "3cd2918c62e5238d58944eca5e3eb3c1aa998611"
}
